{
  "paper_id": "qqc-003-gate-fusion",
  "title": "Quaternionic Gate Fusion on S^3: Geometry-Native Optimization for Single-Qubit Circuit Segments",
  "slug": "gate-fusion",
  "version": "0.1.0",
  "status": "draft",
  "publication_date": null,
  "last_updated": "2026-04-09",
  "authors": [
    {
      "name": "John G. Van Geem",
      "affiliation": "RQM Technologies",
      "orcid": "0009-0002-4003-8452",
      "email": null,
      "corresponding": true
    }
  ],
  "abstract": "This paper studies a local optimization pass for single-qubit circuit segments using the canonical quaternionic intermediate representation defined in qqc-002-canonical-ir. A maximal run of adjacent single-qubit gates on one wire is translated into unit quaternions, multiplied in circuit order, re-normalized, and sign-canonicalized on the quotient q ~ -q induced by global-phase removal. The result is a unique canonical fused representative in S^3 for the segment action modulo global phase. A layered reconstruction strategy then emits either no gate, an exact named gate, an exact axis-aligned rotation, or a generic single-qubit primitive when no simpler interpretable output is available. The paper proves exact equivalence preservation up to global phase, determinism of the fused representative under the fixed canonicalization rule, and minimality of the fully fused segment in the quaternionic IR itself. A small reference benchmark corpus shipped with the paper package is evaluated by an included plain-Python harness. On 13 measured segments containing 36 input single-qubit gates, the local fusion pass reconstructs to 11 output gates while preserving exact segment action under the authoritative canonical-quaternion equivalence check. Two segments eliminate to identity, and 8 of 13 outputs are recovered as either named gates or axis-aligned rotations. These measurements are limited to the included single-qubit reference corpus and are not presented as a claim of universal compiler superiority.",
  "keywords": [
    "quaternionic gate fusion",
    "single-qubit optimization",
    "compiler method",
    "SU(2)",
    "unit quaternions",
    "local circuit simplification"
  ],
  "series": "RQM Quaternionic Quantum Computing Series",
  "series_number": 3,
  "depends_on": [
    "qqc-001-foundations",
    "qqc-002-canonical-ir"
  ],
  "canonical_url": null,
  "pdf_url": null,
  "html_url": null,
  "jats_url": null,
  "doi": null,
  "journal": null,
  "volume": null,
  "issue": null,
  "pages": null,
  "citations": [
    "cross2022",
    "hall2015",
    "kuipers1999",
    "nielsen2010",
    "smith2016"
  ],
  "related_artifacts": [
    "main.tex",
    "artifacts/figures/fig-fusion-pipeline.svg",
    "artifacts/figures/fig-canonical-hemisphere.svg",
    "artifacts/figures/fig-segment-boundaries.svg",
    "artifacts/figures/fig-before-after.svg",
    "artifacts/code/benchmark_gate_fusion.py",
    "artifacts/code/benchmark_results.json",
    "artifacts/notebooks/README.md",
    "artifacts/code/README.md"
  ],
  "license": "CC-BY-4.0",
  "notes": "Draft optimization-method paper defining and evaluating a local quaternionic gate-fusion pass for single-qubit circuit segments. The benchmark numbers reported in the paper are computed by the shipped plain-Python harness on a small reference corpus rather than inferred or fabricated."
}
