{
  "paper_id": "qqc-001-foundations",
  "title": "Foundations of Quaternionic Quantum Computing: Qubits, Spinors, and SU(2) Geometry",
  "slug": "foundations",
  "version": "0.1.0",
  "status": "draft",
  "publication_date": null,
  "last_updated": "2026-04-09",
  "authors": [
    {
      "name": "RQM Technologies Research Team",
      "affiliation": "RQM Technologies",
      "orcid": null,
      "email": "research@rqm-technologies.com",
      "corresponding": true
    }
  ],
  "abstract": "This paper assembles a conservative mathematical foundation for the use of quaternions in single-qubit quantum computing. The goal is not to replace standard quantum mechanics, but to organize familiar structures in a way that makes their geometry more explicit. We distinguish carefully between normalized state vectors in C^2 ≅ R^4, the unit sphere S^3 inside that space, pure states modulo global phase, the projective space CP^1 ≅ S^2, the single-qubit gate group U(2), and SU(2) representatives obtained after removing global phase. Within that framework, we exhibit an explicit isomorphism between the unit quaternions and SU(2), explain why unit quaternions are therefore a natural model for single-qubit gates modulo global phase, and show how quaternion multiplication exposes the axis-angle and composition structure of rotations. Standard facts are separated from the organizational choices adopted in the RQM Technologies series. The paper is restricted to single-qubit structure and makes no claim about new physics, multi-qubit quaternionic state evolution, or computational advantage.",
  "keywords": [
    "qubit geometry",
    "spinors",
    "SU(2)",
    "unit quaternions",
    "Bloch sphere",
    "single-qubit gates"
  ],
  "series": "RQM Quaternionic Quantum Computing Series",
  "series_number": 1,
  "depends_on": [],
  "canonical_url": null,
  "pdf_url": null,
  "html_url": null,
  "jats_url": null,
  "doi": null,
  "journal": null,
  "volume": null,
  "issue": null,
  "pages": null,
  "citations": [
    "adler1995",
    "bloch1946",
    "hall2015",
    "kuipers1999",
    "nielsen2010",
    "penrose1984"
  ],
  "related_artifacts": [
    "main.tex",
    "artifacts/figures/fig-spinor-quotient.svg",
    "artifacts/figures/fig-su2-quaternion.svg",
    "artifacts/figures/fig-axis-angle.svg",
    "artifacts/notebooks/README.md",
    "artifacts/code/README.md"
  ],
  "license": "CC-BY-4.0",
  "notes": "Draft foundation paper for the series. The current author record is organizational; individual contributor metadata may be refined later without changing the paper ID."
}
